{
  "name": "http",
  "plugin_type": "source",
  "description": "The http source accepts HTTP requests on a configurable port and converts them into Data Prepper events.",
  "properties": {
    "port": {
      "type": "integer",
      "description": "The port number on which the HTTP source runs. Default is <code>2021</code>.",
      "required": false,
      "default": 2021
    },
    "path": {
      "type": "string",
      "description": "The HTTP path on which the source receives requests. Default is <code>/log/ingest</code>.",
      "required": false,
      "default": "/log/ingest"
    },
    "ssl": {
      "type": "boolean",
      "description": "Enables SSL/TLS encryption. When enabled, requires SSL certificate configuration.",
      "required": false,
      "default": false
    },
    "ssl_certificate_file": {
      "type": "string",
      "description": "Path to the SSL certificate file. Required when <code>ssl</code> is <code>true</code>.",
      "required": false
    },
    "ssl_key_file": {
      "type": "string", 
      "description": "Path to the SSL private key file. Required when <code>ssl</code> is <code>true</code>.",
      "required": false
    }
  }
}